https://vk.com/wall-192681128_5432;https://vk.com/club192681128?w=wall-192681128_5432;https://vk.com/club192681128;https://vk.com/club192681128;2024-05-31 11:03;🦷 Электрическая зубная щетка Sonic Toothbrush X-3 - идеальное средство для здоровья вашей улыбки!   https://ya.cc/m/dOw1W8B  🌟 Ультразвуковая технология обеспечивает эффективную и бережную чистку зубов.  💪 С разнообразными режимами и таймером, она помогает поддерживать оптимальное здоровье полости рта.  💯 Получите идеально чистые зубы с этой передовой зубной щеткой! 💫;0;0;0;13;;МНОГО СКИДОК;3457https://vk.com/wall-191474968_2755;https://vk.com/club191474968?w=wall-191474968_2755;https://vk.com/club191474968;https://vk.com/club191474968;2024-05-31 20:34;Электрическая зубная щетка SONIC TOOTHBRUSH X-3,  Цена 250₽🤗🏃🏻  🤗Подпишитесь 🤝на наши группы и совершайте заказы🛍Каждый день новые поступления🤗 ✅Группа ВК 👉https://vk.com/tristoree  ✅Телеграмм 👉https://t.me/tristoree  ✅Вы можете по всем вопросам и заказам обращаться на WhatsApp https://wa.me/79296220292;1;0;0;12;;ТЕЛЕФОНЫ & АКСЕССУАРЫ;10533https://vk.com/wall-197672198_15461;https://vk.com/club197672198?w=wall-197672198_15461;https://vk.com/club197672198;https://vk.com/club197672198;2024-05-31 14:00;Каталоги товаров выходного дня с 31 мая по 2 июня 2024 в М.Видео и Эльдорадо    ▪ М.Видео - товары со скидками до 16000₽ (https://go.redav.online/fceb90a0f4db5f50?erid=LdtCKU5a7)  Сегодня действуют скидки на кофемашину, смартфон, кинотеатр Wink, сковороду, тостер и аккумуляторную пилу.  • Кофемашина Supra CMS-3600 (https://go.redav.online/aad313a092b58a00?erid=LdtCKU5a7&m=1) за 27999₽ вместо 43999₽  • Смартфон Samsung Galaxy A55 5G 8/128GB Blue Black (https://go.redav.online/04195240b741dfa0?erid=LdtCKU5a7&m=1) за 38999₽ вместо 43999₽  • Онлайн-кинотеатр Wink на 12 месяцев (https://go.redav.online/064e88a03e44ed90?erid=LdtCKU5a7&m=1) за 550₽ вместо 1799₽  • Сковорода Hi MVLCS23222/11 (https://go.redav.online/44122eaeef3db960?erid=LdtCKU5a7&m=1) за 999₽ вместо 1999₽  • Тостер Oasis TR-2B (https://go.redav.online/d58685bfb962a940?erid=LdtCKU5a7&m=1) за 1290₽ вместо 1890₽  • Аккумуляторная цепная пила Huter ELS-36/2 Li (https://go.redav.online/ab42921adcfe0c70?erid=LdtCKU5a7&m=1) за 7990₽    ▪ Эльдорадо - товары со скидками до 2500₽ (https://go.redav.online/108d0c4b36a27a70?erid=LdtCKgWEj)  В Эльдорадо скидки на смартфон, вентилятор, музыкальный центр, эл. зубную щетку, дрель и УШМ.  • Смартфон Samsung Galaxy A15 LTE 4/128GB Blue Black (SM-A155FZKD) (https://go.redav.online/f1424b79e8605a80?erid=LdtCKgWEj&m=1) за 13999₽ вместо 15999₽  • Вентилятор напольный Primera SFP-3005TX (https://go.redav.online/a70a92da39f40860?erid=LdtCKgWEj&m=1) за 1199₽ вместо 1699₽  • Музыкальный центр Hyundai H-MC1231 (https://go.redav.online/272eeec248433820?erid=LdtCKgWEj&m=1) за 4999₽ вместо 6799₽  • Электрическая зубная щетка Usmile Y1S Green (https://go.redav.online/27b08b6e3f688b80?erid=LdtCKgWEj&m=1) за 1999₽ вместо 4499₽  • Аккумуляторная дрель-шуруповерт Oasis ASU-18S (S) (https://go.redav.online/c45d03dec2a219e0?erid=LdtCKgWEj&m=1) за 2790₽ вместо 4990₽  • Угловая шлифовальная машина Sturm! AG90125 (https://go.redav.online/b30a3fb3c7b12210?erid=LdtCKgWEj&m=1) за 1990₽ вместо 3850₽    ▪ Промокоды и акции М.Видео и Эльдорадо в июне 2024 года (https://moibonus.ru/shortcode/promokod-m-video-i-eldorado/);0;0;0;11;;MoiBonus | скидки, промокоды, акции;2508https://vk.com/wall-135613909_782;https://vk.com/club135613909?w=wall-135613909_782;https://vk.com/club135613909;https://vk.com/club135613909;2024-05-31 10:43;Чем же так опасен налет?    Тем, что из-за него можно остаться без зубов. Потихоньку, постепенно мягкий налет минерализуется, становится твердым, к нему присоединяются новые полчища бактерий. Бактерии выделяют продукты жизнедеятельности. Всё это превращается в залежи зубного камня.    Камень невозможно убрать в домашних условиях. Ни суперскоростной электрической щеткой, ни ирригатором, ни бабушкиными заклинаниями 😁. Если оставить, как есть, то последствия будут. Камень ー прекрасная среда для патогенных бактерий. Патогены выделяют токсины, поражают эмаль, съедают стенки зуба 😬    Что мы обычно наблюдаем у пациентов с застарелым камнем, когда снимаем его?    1. Кариес. 2. Болезни десен. 3. Дефекты эмали.    Да, камень умудряется протиснуться даже под десну ー образует зубодесневые карманы. В эти карманы непременно набиваются остатки ужина, бактерии и вообще всё, что может набиться. Здравствуй, воспаление и его вечный спутник, поражение связочного аппарата. Того самого, который удерживает зуб в десне 🦷    Но вы знаете, как не допустить столь драматичного сценария. Просто регулярно приходить на профессиональную гигиену. Особенно, если вы замечаете склонность к образованию камня или не уверены в качестве домашней гигиены. ______________________  Запись по номеру ⤵  ☎ 89509880303  Или в сообщения;2;0;0;11;;"Стоматология ""Здоровые Зубки""";460https://vk.com/wall757007707_1066;https://vk.com/id757007707?w=wall757007707_1066;https://vk.com/id757007707;https://vk.com/id757007707;2024-05-31 13:29;"А нужны ли...   В который раз натыкаюсь на мыслю, видимо популярную у мужчин: а нужна ли женщина мужчине. Оффторететно зоифляю: не нужна! Фу, брось каку.  Посмотрим вокруг: роботы пылесосы с сухой и влажной уборкой, роботы мойщики окон, мультиварки, стиральные и посудомоечные машины, швабры с распылителем и отжимом, в конце концов система умный дом, клининг компании, сервисы доставки, наконец взрослые игрушки, фильмы, мультфильмы и вещи с эффектом объятий... На утро помогут кофемашина и тостер, на вечер - мультиварка. Скоро вслед за электрической зубной щёткой появится и автоматическая расчёска)   ""Потребительское отношение""? Верно. Подобный образ мышления транслируют промужские, маскулистские сообщества. У человека, который ищет человека для души, чтобы любить и быть любимым, не возникнет подобных вопросов. Независимо от пола, гендера и ориентации";1;0;0;9;;Маргарита Шведова;32https://vk.com/wall-77383518_49327;https://vk.com/club77383518?w=wall-77383518_49327;https://vk.com/club77383518;https://vk.com/club77383518;2024-05-31 17:27;❗ Электрическая зубная щетка realme RTX2103 Blue  👉 Перейти к акции https://kups.club/goto/3bl9mm/vk  ✔ Цена 555 р.             МодельRTX2103Гарантия 1 год 20000 движений в минуту Антибактериальные щетинки  Dupont ™ 99,99% USB Type-C Количество насадок1 шт Время непрерывной работы 260 мин  #купоны #скидки #акции #халява #распродажа #;0;0;0;5;;Лови скидос;12410https://vk.com/wall-213264828_38302;https://vk.com/club213264828?w=wall-213264828_38302;https://vk.com/club213264828;https://vk.com/club213264828;2024-05-31 20:08;250 р без выбора цвет. электрическая зубная щетка c 3 запасными насадками (код Арт: 9366748;0;0;0;4;;COOL_LOOK | Одежда для всей семьи Киров.;532https://vk.com/wall-224560852_2;https://vk.com/club224560852?w=wall-224560852_2;https://vk.com/club224560852;https://vk.com/club224560852;2024-05-31 19:25;📅 Инфоповоды ИЮНЬ 2024    ✔1 июня  Всемирный день родителей  Международный день защиты детей  День рождения «Супермена»  Международный день настольных игр    ✔2 июня  День мелиоратора  День спутникового мониторинга и навигации    ✔3 июня  День рождения парашюта  Праздник прогульщика  Всемирный день велосипеда    ✔4 июня  День крановщика (День машиниста грузоподъемного крана)  День коньяка  День сыра  Международный день спойлеров    ✔5 июня  День эколога  Международный день бега  День портных  День кетчупа  День самогона    ✔6 июня  День русского языка  День рождения «тетриса»  День рождения электрического утюга  День автокинотеатров    ✔7 июня  День пончика  День видеомагнитофона    ✔8 июня  Всемирный день океанов  День мебельщика  День пивовара  День социального работника  День рождения пылесоса  Международный день IPv6    ✔9 июня  День работников текстильной и лёгкой промышленности  Международный день друзей  Международный день архивов  День Дональда Дака    ✔10 июня  День рождения шариковой ручки  Всемирный день ремесленничества  Всемирный день мороженого    ✔11 июня  Общероссийский день рассеянного склероза    ✔12 июня  День России  День рождения противогаза    ✔13 июня  День швейной машинки    ✔14 июня  День работников миграционной службы  Международный день блогера  Всемирный день донора крови    ✔15 июня  Всемирный день ветра  День силы улыбки  Международный день прогулки    ✔16 июня  День медицинского работника  День отца    ✔17 июня  Всемирный день мотоциклиста  День яблочного штруделя    ✔18 июня  День сыроделов  Международный день суши  День устойчивой гастрономии    ✔19 июня  День мартини  День кота Гарфилда    ✔20 июня  Всемирный день Wi-Fi  День чайных покупок  Международный день серфинга    ✔21 июня  День кинолога  Международный день скейтбординга  Международный день йоги  Международный день футболки  Всемирный день жирафов  День селфи    ✔22 июня  День памяти и скорби (День начала ВОВ)    ✔23 июня  Международный день балалайки  День государственной службы ООН  Международный Олимпийский день  День рождения пишущей машинки    ✔24 июня  Международный день феи    ✔25 июня  День моряка (мореплавателя)  День работников статистики  Глобальный день «Битлз»  День цветного телевидения    ✔26 июня  День рождения зубной щетки  День косметолога    ✔27 июня  Всемирный день рыболовства  День молодежи  День рождения банкомата  День микро, малых и средних предприятий  День солнцезащитных очков  Всемирный день смурфиков    ✔28 июня  День российского букмекера  День страхования  День клавиши CAPS LOCK    ✔29 июня  День изобретателя и рационализатора  Международный день промышленного дизайна  День поисков кладов и секретов  День учреждения Нобелевской Премии  День фотоаппарата    ✔30 июня  День экономиста  Всемирный день социальных сетей  Международный день астероида    #инфоповоды;1;0;0;4;;ART BOOST | Digital-агентство;2https://vk.com/wall-225775268_72;https://vk.com/club225775268?w=wall-225775268_72;https://vk.com/club225775268;https://vk.com/club225775268;2024-05-31 13:41;#aliexpress  Рюкзак для ноутбука за 1197₽  Ссылка➡ https://aliclick.shop/r/c/1seb4xzzb8gnotv4?erid=2SDnj…  Смарт-часы GTS 3 Plus за 2619₽  Ссылка➡ https://aliclick.shop/r/c/1seb4yk4iu87jfil?erid=2SDnjbu…  Умный датчик открытия дверей / окон SZKOSTON за 372₽ Ссылка➡ https://aliclick.shop/r/c/1seb4z5vodbs68u0?erid=2SDn…  Электрическая зубная щётка Mornwell T37 за 1199₽ Ссылка➡ https://aliclick.shop/r/c/1seb51ypsq4z32za?erid=2SDnj…  Смартфон Xiaomi 13T 8/256 ГБ за 32329₽ Ссылка➡ https://aliclick.shop/r/c/1seb52ntrm1jie6k?erid=2SDnjd…;0;0;0;4;;По Татарски Сказочно;2713https://vk.com/wall-213264828_38306;https://vk.com/club213264828?w=wall-213264828_38306;https://vk.com/club213264828;https://vk.com/club213264828;2024-05-31 20:10;70 руб электрическая зубная щетка с мультяшным рисунком, 1 насадка кухный детская зубная щетка soft единорога Арт: 9264296;0;0;0;3;;COOL_LOOK | Одежда для всей семьи Киров.;532https://vk.com/wall-155485623_18113;https://vk.com/club155485623?w=wall-155485623_18113;https://vk.com/club155485623;https://vk.com/club155485623;2024-05-31 16:40;#aliexpress  Электрическая звуковая зубная щетка Mornwell T38   ▫️Цена с купоном продавца на скидку 188₽: 1284₽     Купить - https://alli.pub/6ytiw1?erid=2SDnje9zuUD  Подписаться на «Лавка Скидок» — https://t.me/+oL1l9JSBgJQwOTIy;0;0;0;3;;Лавка Скидок;462https://vk.com/wall-183896251_107040;https://vk.com/club183896251?w=wall-183896251_107040;https://vk.com/club183896251;https://vk.com/club183896251;2024-05-31 19:26;🇷🇺 Электрическая зубная щетка Realme M2 RTX2102 по супер цене за 555 руб в Мега Маркет https://shp.pub/6ytkjc  Выбираем продавца Мвидео  Мощный мотор 41 000 об/мин / Антибактериальная щетка DuPont 99,9% / Type-C зарядка и до 80 дней работы / 4 режима чистки / Защита от воды IPX7  #halfree;0;0;0;2;;Halfree ali ali ali;1140https://vk.com/wall-225775274_61;https://vk.com/club225775274?w=wall-225775274_61;https://vk.com/club225775274;https://vk.com/club225775274;2024-05-31 13:41;#aliexpress  Рюкзак для ноутбука за 1197₽  Ссылка➡ https://aliclick.shop/r/c/1seb4xzzb8gnotv4?erid=2SDnj…  Смарт-часы GTS 3 Plus за 2619₽  Ссылка➡ https://aliclick.shop/r/c/1seb4yk4iu87jfil?erid=2SDnjbu…  Умный датчик открытия дверей / окон SZKOSTON за 372₽ Ссылка➡ https://aliclick.shop/r/c/1seb4z5vodbs68u0?erid=2SDn…  Электрическая зубная щётка Mornwell T37 за 1199₽ Ссылка➡ https://aliclick.shop/r/c/1seb51ypsq4z32za?erid=2SDnj…  Смартфон Xiaomi 13T 8/256 ГБ за 32329₽ Ссылка➡ https://aliclick.shop/r/c/1seb52ntrm1jie6k?erid=2SDnjd…;0;0;0;2;;Промокоды Мегамаркет | Кэшбэк & Сберспасибо;1475https://vk.com/wall-4041570_81938;https://vk.com/club4041570?w=wall-4041570_81938;https://vk.com/club4041570;https://vk.com/club4041570;2024-05-31 08:21;🔥Продам новую ORAL-B / ORAL_B Электрическую зубную щетку (3+ лет)  2000 рублей🔥   Хабаровск.      📞89141505088;0;0;0;2;;ХабМаркет - объявления Хабаровска;3874https://vk.com/wall-112955088_76614;https://vk.com/club112955088?w=wall-112955088_76614;https://vk.com/club112955088;https://vk.com/club112955088;2024-05-31 13:56;Электрическая зубная щетка Mornwell T37  https://alii.pub/6y52gm  Берём купон на скидку 187₽:  1 198₽  За такую цену нигде не найдёте электрическую щётку с такими функциями.  Щётка имеет 3 режима работы: отбеливание, деликатная чистка и массаж. Каждые 30 секунд щетка оповещает, что пора сменить зону чистки зубов. Защищена по стандарту IPX7 — щетку можно мыть под струёй воды.  В комплекте 4 сменные насадки средней жесткости, поэтому ближайший год можно не думать о их покупке. Аккумулятора хватит на месяц использования. #halfree;0;0;0;0;;HalFree для GAMERa;551https://vk.com/wall-220037320_7030;https://vk.com/club220037320?w=wall-220037320_7030;https://vk.com/club220037320;https://vk.com/club220037320;2024-05-31 13:12;Международный бренд бытовой техники Polaris презентовал монопучковые насадки для электрических зубных щеток. Насадка TBH 0105 MP с щетиной средней жёсткости подходит для любой зубной щётки Polaris.;0;0;0;0;;Актуальные новости, события, происшествия Урала;8