ССЫЛКА НА ЗАПИСЬ;ССЫЛКА НА ЗАПИСЬ С УЧЁТОМ ВЛАДЕЛЬЦА;ВЛАДЕЛЕЦ СТЕНЫ;АВТОР ЗАПИСИ;ДАТА И ВРЕМЯ;ТЕКСТ ПОСТА;ЛАЙКОВ;РЕПОСТОВ;КОММЕНТАРИЕВ;ПРОСМОТРОВ;ССЫЛКА НА КОММЕНТАРИЙ;НАЗВАНИЕ АВТОРА;ПОДПИСЧИКОВhttps://vk.com/wall-119025380_194409;https://vk.com/club119025380?w=wall-119025380_194409;https://vk.com/club119025380;https://vk.com/club119025380;2024-05-31 20:00;Идеи подарков 🎁  1. Костюм с начесом Арт. 198232573 2. Пижама со штанами Арт. 213418996 3. Чай зеленый с мятой в стиках Арт. 219661120 4. Саше ароматическое Арт. 230070445 5. Манекен для причесок Арт. 211952329 6. Фруктовница металлическая Арт. 205052814 7. Сумка кросс-боди Арт. 171820400 8. Органайзер для ватных дисков и ушных палочек Арт. 222983606 9. Электрическая зубная щетка Арт. 199122824;282;0;2;2019;;МИР WILDBERRIES | Валдберрис | Находки | Вб | WB;181016https://vk.com/wall-79087877_424642;https://vk.com/club79087877?w=wall-79087877_424642;https://vk.com/club79087877;https://vk.com/club79087877;2024-05-31 17:48;🇷🇺 Электрическая зубная щетка Realme M2 RTX2102 по супер цене за 555 руб в Мега Маркет https://shp.pub/6ytkhs  Выбираем продавца Мвидео  Мощный мотор 41 000 об/мин / Антибактериальная щетка DuPont 99,9% / Type-C зарядка и до 80 дней работы / 4 режима чистки / Защита от воды IPX7  #Щетки #Мвидео;2;1;1;469;;Добрый Мао;17627https://vk.com/wall-131637011_90111;https://vk.com/club131637011?w=wall-131637011_90111;https://vk.com/club131637011;https://vk.com/club131637011;2024-05-31 13:00;Электрическая зубная щетка Mornwell T37  https://alii.pub/6yszdw?erid=2SDnjeH6NKK  Берём купон на скидку 187₽:  1 198₽  За такую цену нигде не найдёте электрическую щётку с такими функциями.  Щётка имеет 3 режима работы: отбеливание, деликатная чистка и массаж. Каждые 30 секунд щетка оповещает, что пора сменить зону чистки зубов. Защищена по стандарту IPX7 — щетку можно мыть под струёй воды.  В комплекте 4 сменные насадки средней жесткости, поэтому ближайший год можно не думать о их покупке. Аккумулятора хватит на месяц использования.;0;0;0;444;;Aliexpress для геймеров;124681https://vk.com/wall-79087877_424633;https://vk.com/club79087877?w=wall-79087877_424633;https://vk.com/club79087877;https://vk.com/club79087877;2024-05-31 13:55;🇷🇺 Электрическая зубная щетка Usmile Y1S Green по скидке дня за 1 999 руб в Эльдорадо https://shp.pub/6ytdrw  В комплекте чехол + 2 насадки  #Щетки #Эльдорадо;1;1;0;439;;Добрый Мао;17627https://vk.com/wall-38127613_124627;https://vk.com/club38127613?w=wall-38127613_124627;https://vk.com/club38127613;https://vk.com/club38127613;2024-05-31 16:30;‼🔥РАСПРОДАЖА🔥‼  Электрическая зубная щетка Sonic X3  Цена 250 руб  Предоставляется без выбора  Преимущества электрической зубной щетки Sonic X3 в вымëтающих движениях щетинок, в отличие от круглых вращательных зубных головок, они помогут вам эффективнее очистить межзубные промежутки и укрепить ваши десны. А 6 режимов работы с звуковыми колебаниями до 42 000 в минуту максимально качественно очистят ваши зубы. Зарядный кабель щётки с usb разъëмом позволит заряжать еë от любого устройства с выходом usb: ноутбука, внешнего аккумулятора или использовать универсальный адаптер. Степень заряда зубной щëтки вы легко сможете определить по индикатору на корпусе.;0;1;0;381;;1000 мелочей САДОВОД 6-06;189567https://vk.com/wall-202352146_29127;https://vk.com/club202352146?w=wall-202352146_29127;https://vk.com/club202352146;https://vk.com/club202352146;2024-05-31 16:20;"Электрическая зубная щётка Mornwell T37  https://alli.pub/6yt92q?erid=2SDnjdpu9BF  Купон 187 руб Цена 1199 руб  3 режима работы Таймер 4 насадки в комплекте Защита IPX7 Автономность до 30 дн  Реклама ООО ""АЛИБАБА.КОМ (РУ)"" ИНН 7703380158";1;1;0;325;;Электроника с Алика;90489https://vk.com/wall-213396109_6729;https://vk.com/club213396109?w=wall-213396109_6729;https://vk.com/club213396109;https://vk.com/club213396109;2024-05-31 01:00;"Пижама женская с шортами - https://alii.pub/6ysmsn?erid=2SDnjceQaaV  Скрытая мини камера видеонаблюдения, онлайн видеоняня Full HD - https://alii.pub/6ysmtm?erid=2SDnjcskU7b  Смартфон Huawei Nova N12s 8+256 - https://alii.pub/6ysmus?erid=2SDnjd2ePof  Средство для пола SYNERGETIC ""Горная лаванда"", антибактериальное, 750 мл - https://alii.pub/6ysmvk?erid=2SDnjdA4LDP  Средство Крот для чистки, прочистки труб, антизасор, от засоров ""Чистые трубы"" Золушка 90г - https://alii.pub/6ysmvy?erid=2SDnjdHUGd7  Телевизор HD OLTO 32T20H, DVB-T/T2 диагональ 32"" (81 см), черный, гарантия 1 год - https://alii.pub/6ysmwj?erid=2SDnjdWpAAD  Чай черный Richard Royal Candy Pear, со вкусом карамелизированной груши, 25 пакетиков - https://alii.pub/6ysn1e?erid=2SDnjcDD8GZ  Шампунь для восстановления структуры волос ""OLLIN PROFESSIONAL"" CARE 1000мл - https://alii.pub/6ysn1z?erid=2SDnjcYUxw3  Электрическая зубная щетка Xiaomi Mijia Electric Toothbrush T200 - https://alii.pub/6ysn53?erid=2SDnjdTrX5T   🔥 Скидки дня на Магнит Маркете    ⚠ Промокоды в закреплённом посте    Реклама: ООО ""Магнит Маркет"" ИНН: 1648054022";3;0;0;323;;Находки с Магнит Маркет (ex. KazanExpress);15198https://vk.com/wall-160262240_100501;https://vk.com/club160262240?w=wall-160262240_100501;https://vk.com/club160262240;https://vk.com/club160262240;2024-05-31 13:03;ПРАЗДНИЧНЫЕ ДАТЫ ИЮНЯ    📌 По традиции подготовила для вас полный список праздничных дат июня. Сохраните на стену чтобы не потерять -» Используйте для постов  ✋ Для вашего удобства к посту прикреплен файл с формате Word. В нём уже добавлены смайлы цифр. Копируйте текст из файла, чтобы цифры отобразились в посте  1⃣ июня - Международный день детей (День защиты детей)  Всемирный день родителей  Всемирный день молока  День черепашьих гонок  День рождения «Супермена»  Первый день лета    2⃣ июня – День здорового питания и отказа от излишеств в еде  День мелиоратора  День запуска бумажных змеев и самолетиков  Праздник падающих шкафов    3⃣ июня – Всемирный день велосипеда  День рождения парашюта  Праздник прогульщика  День вспоминания о снеге  Всемирный день косолапости    4⃣ июня – День крановщика  День рождения журнала «Крокодил»  День любителей лета    5⃣ июня – Всемирный день окружающей среды (День эколога)  Всемирный день бега  День образования полиции России  Праздник солнечных зайчиков  День резиновых уточек в ванной  Праздник популярных заблуждений    6⃣ июня – Пушкинский день в России  День русского языка  День рождения электрического утюга  День рождения «тетриса»  День рисования драконов    7⃣ июня – Всемирный день безопасности пищевых продуктов  День краудфандинга  День июньского жука  День пробной технологии  День незнакомой кофейни  Всемирный день заботы    8⃣ июня - Всемирный день океанов  День социального работника в России  Всемирный день петербургских котов и кошек  День мебельщика  Международный день домохозяйки и домохозяина  День рождения пылесоса  День таинственных знаков и предсказаний  Всемирный день куклы  Международный день молодых орлов  Всемирный день вязания на публике    9⃣ июня - Международный день друзей  Международный день архивов  День работников легкой промышленности  Международный день аккредитации  День пускания мыльных пузырей  День магических кругов  День Кораллового треугольника  Международный день кельтского искусства    1⃣ 0⃣ июня – Всемирный день мороженого  Всемирный день модерна  День рождения шариковой ручки  День рождения киностудии Союзмультфильм  День разрисованных ладоней  Всемирный день ремесленничества    1⃣ 1⃣ июня – Всемирный день мотоциклиста  День поиска новой звезды  Всемирный день ягуара    1⃣ 2⃣ июня – День России  День рождения противогаза  День гуляния с воздушным шариком    1⃣ 3⃣ июня - День швейной машинки  День божьих коровок  День рождения булавки  День маленького путешествия    1⃣ 4⃣ июня - Всемирный день донора крови  Международный день блогера  Международный банный день  День работника миграционной службы России  День кофейных зерен    1⃣ 5⃣ июня – Всемирный день ветра  Всемирный день жонглирования  Праздник мужских недостатков  День придумывания новых созвездий    1⃣ 6⃣ июня – День медицинского работника  Международный день семейных денежных переводов  День младших братьев  Международный день морской черепахи  Международный день водопада  День отправления в дальнее плавание трех бумажных корабликов    1⃣ 7⃣ июня – День приманивания муз  Всемирный день крокодила  Всемирный день карате    1⃣ 8⃣ июня – Международный день паники  День рождения детской коляски  Всемирный день гармонии  Международный день пикника  День недалекого будущего  День поиска четырехлистного клевера  Международный день суши    1⃣ 9⃣ июня – Международный день прогулки  Всемирный день детского футбола  Международный день коробки  День наблюдения за облаками    2⃣ 0⃣ июня – Всемирный день защиты слонов в зоопарках  Всемирный день Wi-Fi  День чайных покупок  Всемирный день эффективности  День перерыва в работе  Международный день тенниса    2⃣ 1⃣ июня - Международный день йоги  Международный день празднования солнцестояния  Всемирный гидрографии  Всемирный день гуманизма  Международный день скейтбординга  День селфи  Международный день цветка  День солнечных зайчиков  Всемирный день рукопожатий  Международный день футболки  Всемирный день жирафа    2⃣ 2⃣ июня - День памяти и скорби — день начала Великой Отечественной войны (1941 год)  День подмигивания кошкам  День шоколадного эклера  День позитивных медиа  Всемирный день верблюда    2⃣ 3⃣ июня – Троица  Международный Олимпийский день  День балалайки — международный праздник музыкантов-народников  День государственной службы ООН   День рождения пишущей машинки  День без обид  День тайных посланий  День женщин-инженеров    2⃣ 4⃣ июня – Международный день феи  День разноцветных стекол    2⃣ 5⃣ июня – День дружбы и единения славян  День моряка (День мореплавателя)  День работников статистики  День улыбок незнакомым людям  Всероссийский день национальной гордости  День козьего сыра  День воды    2⃣ 6⃣ июня – День рождения зубной щетки  День теней на стене    2⃣ 7⃣ июня – Всемирный день рыболовства  День микро-, малых и средних предприятий  День рождения банкомата  Международный день ананаса  День записывания случайных мыслей    2⃣ 8⃣ июня – День сердечных объятий  День российского букмекера  День карусельной лошадки    2⃣ 9⃣ июня – День молодежи России  День изобретателя и рационализатора в России  День партизан и подпольщиков в России  День кораблестроителя в России  Международный день тропиков   День поисков кладов и секретов  Международный день промышленного дизайна  День учреждения Нобелевской премии    3⃣ 0⃣ июня – Международный день астероида  Всемирный день социальных сетей  День разбрасывания монеток  📌 Сохраните пост на стену чтобы не потерять. Используйте подходящие даты для ваших постов.   ****************************************    Подготовила для вас ГОТОВЫЕ сценарии постов для рукодельных групп до конца 2024 года с июня по декабрь  Если хотите экономить время на ведение своей группы, заберите по ссылкам:    ✔ Готовые сценарии постов на июнь - декабрь 2024 года  ⏩ https://monecle.com/buy/55914  Стоимость 1750 руб , вместо 2800 руб    ✔ Готовые сценарии на 2 месяца июнь-июль 600 руб  ⏩ https://monecle.com/buy/65333  получается по 300 руб за месяц   Самое выгодное предложение, забрать ГОТОВЫЕ сценарии на весь ГОД. Получается всего 250 руб в месяц  ⏩ https://monecle.com/buy/55914    #про_контент@biznes_handmade #полезное@biznes_handmade;7;2;0;269;;Бизнес-грамотность для рукодельниц;9477https://vk.com/wall-127460024_33471;https://vk.com/club127460024?w=wall-127460024_33471;https://vk.com/club127460024;https://vk.com/club127460024;2024-05-31 17:42;Электрическая зубная щётка c 3 запасными насадками (Код#1717)    250 р    Без выбора цвет!;2;5;0;263;;Тони Шоп. Садовод корпус Б 2Г-25/ 1000 мелочей;146378https://vk.com/wall-138900023_64804;https://vk.com/club138900023?w=wall-138900023_64804;https://vk.com/club138900023;https://vk.com/club138900023;2024-05-31 14:00;Электрическая зубная щетка Soocas D3 Pro Ссылка: https://kurl.ru/FVjLO Изначальная цена: ₽9,990 Цена со скидкой: ₽3,842 Скидка: 59% OFF;2;0;0;242;;Military Squad | Тактический AliExpress;48857https://vk.com/wall-178233250_24583;https://vk.com/club178233250?w=wall-178233250_24583;https://vk.com/club178233250;https://vk.com/club178233250;2024-05-31 14:00;Электрическая зубная щетка Soocas D3 Pro  Ссылка: https://kurl.ru/FVjLO  Изначальная цена: ₽9,990  Цена со скидкой: ₽3,842  Скидка: 59% OFF;0;0;0;235;;По жизни с AliExpress (Промокоды и Купоны);39228https://vk.com/wall-172430325_77120;https://vk.com/club172430325?w=wall-172430325_77120;https://vk.com/club172430325;https://vk.com/club172430325;2024-05-31 14:15;#aliexpress  ⚡️ Электрическая звуковая зубная щетка Mornwell T38  ▫️ Цена — 1284 ₽, с купоном продавца на 188₽ ▫️ Рейтинг товара — 4.8 (2051 заказ)  Скидка — https://aliclick.shop/r/c/1s1qnbvcng44vdg3;0;0;0;221;;Записки Еврея;4779https://vk.com/wall-148727468_82909;https://vk.com/club148727468?w=wall-148727468_82909;https://vk.com/club148727468;https://vk.com/club148727468;2024-05-31 14:00;Электрическая зубная щетка Soocas D3 Pro  Ссылка: https://kurl.ru/FVjLO  Изначальная цена: ₽9,990  Цена со скидкой: ₽3,842  Скидка: 59% OFF;0;0;0;217;;Надежный Мужской Aliexpress;36092https://vk.com/wall-136481372_45336;https://vk.com/club136481372?w=wall-136481372_45336;https://vk.com/club136481372;https://vk.com/club136481372;2024-05-31 15:42;Товары дня в Эльдорадо: https://clck.ru/sMepZ  • Смартфон Samsung Galaxy A15, вентилятор напольный Primera, музыкальный центр Hyundai, электрическая зубная щётка usmile, аккумуляторная дрель-шуруповерт Oasis и угловая шлифовальная машина Sturm!    Товары дня в М.Видео: https://clck.ru/sMeva  • Кофемашина Supra, смартфон Samsung Galaxy A15, онлайн-кинотеатр Wink, сковорода Hi и тостер Oasis    + получаем [https://vk.com/wall-136481372_45310|500 бонусов за чекин в моб. приложении];0;0;0;189;;Mobiler Скидки AliExpress Мегамаркет Промокоды;2759https://vk.com/wall-129855246_44374;https://vk.com/club129855246?w=wall-129855246_44374;https://vk.com/club129855246;https://vk.com/club129855246;2024-05-31 19:55;🔥Выгодный прайс на электрическую зубную щетку SOOCAS D3 со стерилизатором 💰Цена 2 838₽ (только на зеленый цвет) ✅тут https://bit.ly/4bDAHfD 📌Soocas D3 - это обновленная версия предыдущей модели, она обеспечивает качественный и своевременный уход за полостью рта. До 38.4 тысяч колебаний в минуту, 2 насадки, IPX8, до 180 дней работы без подзарядки.  #WB [club129855246|Сделано в Китае - Промокоды и Скидки];1;1;0;127;;Сделано в Китае - Промокоды и Скидки;23894https://vk.com/wall-220531841_6699;https://vk.com/club220531841?w=wall-220531841_6699;https://vk.com/club220531841;https://vk.com/club220531841;2024-05-31 16:25;Привет 👋 В Магазине KINGSTORE🦁 вы можете приобрести не только технику от Apple, но и фены от Dyson, конструкторы от Xiaomi, игровые приставки Sony Playstation 5.  -Конструктор Xiaomi OneBot(спорткар): 2.990р. -Конструктор Xiaomi OneBot(С пулимётом): 2.990р. -Dyson Airwrap premium: 17.990₽ -Dyson Supersonic HD07: 16.990р. -Dyson Airwrap Complete Long: 28.999р -PlayStation 5: 44.990₽ -AirTag: 5.999р. -Часы X8 41mm: 1990₽ -Часы X8 Pro 45mm: 2990₽ -Часы Watch Ultra premium 49mm: 1990₽ -Часы 8 49mm: 3.990р. -Часы T-800 pro max: 1999р. -AirPods Pro 2(premium): 990₽ -AirPods 2(premium): 2.499р. -AirPods 3(premium): 1.999р. -AirPods Pro(premium): 2.999р. -AirPods 3 ORIGINAL: 18.990₽ -AirPods Pro 2 ORIGINAL: 20.990₽ -AirPods max premium 6.990₽ -Xbox serious S 29.990₽ -Графический планшет Xiaomi 10 дюймов 1790₽ -Графический планшет Xiaomi 13.5 дюймов 2490₽ -водный пистолет 1990₽ -Беспроводные наушники AXXA 2990₽ -часы Watch ultra 2 49 mm premium 3990₽ -часы watch 9 45 mm premium 3990₽ -зубная электрическая щетка Xioami 990₽ -умные очки JBl100 1799₽  А также любая техника от Apple, Sony , DJI, DYSON под заказ в течение четырех рабочих дней.💥  Теперь нет повода отказать себе в покупке!😄  РАССРОЧКА БЕЗ ПЕРЕПЛАТЫ ОТ Халвы🔥  🎉При любой покупке дарим купон на 1000р.  🎁 Получи подарки на выбор на 10000 рублей при покупке любого НОВОГО IPhone.  УЧАСТВУЙ в розыгрыше НОВОГО IPAD.✊  🌋 Кредит на САМЫХ выгодных условиях в городе ОТ 11 БАНКОВ ПАРТНЕРОВ!✊  🔨 Лучший сервис с гарантией  ♻ Выгодный Trade In!!! Сдай свой старый iPhone по выгодной цене и получи хорошую скидку на приобретение нового iPhone в нашем магазине KINGSTORE  📲 Наш номер +79954755532  🌍 Наш адрес Пр. Автозаводцев 61а стр. 1  Наш сайт  https://miass.kingstore.link/;1;1;0;114;;King Store | iPhone Миасс | Сеть магазинов;1322https://vk.com/wall-97027023_98858;https://vk.com/club97027023?w=wall-97027023_98858;https://vk.com/club97027023;https://vk.com/club97027023;2024-05-31 14:57;🔥Электрическая зубная щетка SOOCAS X3 Pro за 3870 рублей 👉https://vk.cc/cxhYBC  ⚡Акция с 10:00 1 июня до 10:00 8 июня  #Wildberries #зубныещетки  Реклама: ООО «Вайлдберриз» (ИНН 7721546864);3;0;0;101;;ChinaMerk: скидки и купоны AliExpress;39143