https://vk.com/wall-161327378_39423;https://vk.com/club161327378?w=wall-161327378_39423;https://vk.com/club161327378;https://vk.com/club161327378;2024-05-31 14:00;Электрическая зубная щетка Soocas D3 Pro  Ссылка: https://kurl.ru/FVjLO  Изначальная цена: ₽9,990  Цена со скидкой: ₽3,842  Скидка: 59% OFF;0;0;0;97;;В Цифре - AliExpress;12834https://vk.com/wall-192731330_40314;https://vk.com/club192731330?w=wall-192731330_40314;https://vk.com/club192731330;https://vk.com/club192731330;2024-05-31 14:26;ПРАЗДНИЧНЫЕ ДАТЫ ИЮНЯ  1 июня - Международный день детей (День защиты детей)  Всемирный день родителей  Всемирный день молока  День черепашьих гонок  День рождения «Супермена»  Первый день лета    2 июня – День здорового питания и отказа от излишеств в еде  День мелиоратора  День запуска бумажных змеев и самолетиков  Праздник падающих шкафов    3 июня – Всемирный день велосипеда  День рождения парашюта  Праздник прогульщика  День вспоминания о снеге  Всемирный день косолапости    4 июня – День крановщика  День рождения журнала «Крокодил»  День любителей лета    5 июня – Всемирный день окружающей среды (День эколога)  Всемирный день бега  День образования полиции России  Праздник солнечных зайчиков  День резиновых уточек в ванной  Праздник популярных заблуждений    6 июня – Пушкинский день в России  День русского языка  День рождения электрического утюга  День рождения «тетриса»  День рисования драконов    7 июня – Всемирный день безопасности пищевых продуктов  День краудфандинга  День июньского жука  День пробной технологии  День незнакомой кофейни  Всемирный день заботы    8 июня - Всемирный день океанов  День социального работника в России  Всемирный день петербургских котов и кошек  День мебельщика  Международный день домохозяйки и домохозяина  День рождения пылесоса  День таинственных знаков и предсказаний  Всемирный день куклы  Международный день молодых орлов  Всемирный день вязания на публике    9 июня - Международный день друзей  Международный день архивов  День работников легкой промышленности  Международный день аккредитации  День пускания мыльных пузырей  День магических кругов  День Кораллового треугольника  Международный день кельтского искусства    10 июня – Всемирный день мороженого  Всемирный день модерна  День рождения шариковой ручки  День рождения киностудии Союзмультфильм  День разрисованных ладоней  Всемирный день ремесленничества    11 июня – Всемирный день мотоциклиста  День поиска новой звезды  Всемирный день ягуара    12 июня – День России  День рождения противогаза  День гуляния с воздушным шариком    13 июня - День швейной машинки  День божьих коровок  День рождения булавки  День маленького путешествия    14 июня - Всемирный день донора крови  Международный день блогера  Международный банный день  День работника миграционной службы России  День кофейных зерен    15 июня – Всемирный день ветра  Всемирный день жонглирования  Праздник мужских недостатков  День придумывания новых созвездий    16 июня – День медицинского работника  Международный день семейных денежных переводов  День младших братьев  Международный день морской черепахи  Международный день водопада  День отправления в дальнее плавание трех бумажных корабликов    17 июня – День приманивания муз  Всемирный день крокодила  Всемирный день карате    18 июня – Международный день паники  День рождения детской коляски  Всемирный день гармонии  Международный день пикника  День недалекого будущего  День поиска четырехлистного клевера  Международный день суши    19 июня – Международный день прогулки  Всемирный день детского футбола  Международный день коробки  День наблюдения за облаками    20  июня – Всемирный день защиты слонов в зоопарках  Всемирный день Wi-Fi  День чайных покупок  Всемирный день эффективности  День перерыва в работе  Международный день тенниса    21 июня - Международный день йоги  Международный день празднования солнцестояния  Всемирный гидрографии  Всемирный день гуманизма  Международный день скейтбординга  День селфи  Международный день цветка  День солнечных зайчиков  Всемирный день рукопожатий  Международный день футболки  Всемирный день жирафа    22 июня - День памяти и скорби — день начала Великой Отечественной войны (1941 год)  День подмигивания кошкам  День шоколадного эклера  День позитивных медиа  Всемирный день верблюда    23 июня – Троица  Международный Олимпийский день  День балалайки — международный праздник музыкантов-народников  День государственной службы ООН   День рождения пишущей машинки  День без обид  День тайных посланий  День женщин-инженеров    24 июня – Международный день феи  День разноцветных стекол    25 июня – День дружбы и единения славян  День моряка (День мореплавателя)  День работников статистики  День улыбок незнакомым людям  Всероссийский день национальной гордости  День козьего сыра  День воды    26 июня – День рождения зубной щетки  День теней на стене    27 июня – Всемирный день рыболовства  День микро-, малых и средних предприятий  День рождения банкомата  Международный день ананаса  День записывания случайных мыслей    28 июня – День сердечных объятий  День российского букмекера  День карусельной лошадки    29 июня – День молодежи России  День изобретателя и рационализатора в России  День партизан и подпольщиков в России  День кораблестроителя в России  Международный день тропиков   День поисков кладов и секретов  Международный день промышленного дизайна  День учреждения Нобелевской премии    30  июня – Международный день астероида  Всемирный день социальных сетей  День разбрасывания монеток  #ярмаркалюбимоедело #хвастики;3;0;0;88;;"ЯРМАРКА ИЗДЕЛИЙ РУЧНОЙ РАБОТЫ ""ЛЮБИМОЕ ДЕЛО """;2951https://vk.com/wall-187881351_44875;https://vk.com/club187881351?w=wall-187881351_44875;https://vk.com/club187881351;https://vk.com/club187881351;2024-05-31 16:00;"Электрическая зубная щётка Mornwell T37  https://alli.pub/6yt92x?erid=2SDnjdyo4sK  Купон 187 руб Цена 1199 руб  3 режима работы Таймер 4 насадки в комплекте Защита IPX7 Автономность до 30 дн  Реклама ООО ""АЛИБАБА.КОМ (РУ)"" ИНН 7703380158";0;0;0;57;;Это всё с Aliexpress|ЯМ|Мм и др.;9955https://vk.com/wall-147778104_23236;https://vk.com/club147778104?w=wall-147778104_23236;https://vk.com/club147778104;https://vk.com/club147778104;2024-05-31 20:26;"‼️ Экспресс - быстрый обзор лучших цен.  ➡️ Мужская футболка MTS Fashion за 279 ₽ - https://fas.st/9cvwvv?erid=25H8d7vbP8SRTvH4QP3RzP  ➡️ Телевизор Haier S9, 55"", 4K UHD, Oled, Smart TV за 78 990 ₽ - https://fas.st/Kc7HLL?erid=25H8d7vbP8SRTvH4QP3RzP ➕ Промокод - ВПИСКА  ➡️ Автомобильный компрессор Gigant, 12 В, 15 А, 10 атм за 1 046 ₽ - https://fas.st/KpJZzY?erid=LatgBxXun ➕ Промокод - V8H4LX4X   ➡️ Столовый сервиз Luminarc 19 пр [кэшбэк до 4 663 бонусов] за 6 957 ₽ - https://fas.st/sMCrg3?erid=25H8d7vbP8SRTvH4QP3RzP  ➡️ Смартфон Xiaomi 14 12/512 Гб, глобал за 67 095 ₽ - https://ali.ski/FMVBWJ?erid=25H8d7vbP8SRTvJ4Q27doN  ➡️  Электрическая зубная щетка realme, Type-C, 3 режима за 555 ₽ - https://fas.st/ukX2a?erid=25H8d7vbP8SRTvH4QP3RzP  ➡️ Посудомоечная машина Gorenje, AquaStop, 85х60х58 см за 24 000 ₽ - https://fas.st/S27xJs?erid=25H8d7vbP8SRTvH4QP3RzP  ➡️ Полировальная шлифмашина Интерскол, 1 300 Вт, 180 мм, 6 скоростей за 5 604 ₽ - https://fas.st/eSzpsK?erid=25H8d7vbP8SRTvGa615iug  ➡️ Наручные часы CASIO Collection, 45x45 мм, WR50 за 2 258 ₽ - https://ali.ski/P2AKK?erid=25H8d7vbP8SRTvJ4Q27doN  ➡️ Кекс Умный выбор шоколадный, 350 г за 96 ₽ - https://fas.st/D3rpB?erid=25H8d7vbP8SRTvH4QP3RzP  ➡️ Икра кабачковая Дядя Ваня 460 г за 79 ₽ - https://fas.st/qmEef?erid=25H8d7vbP8SRTvH4QP3RzP  Указанные цены актуальны в момент публикации и могут изменится в любой момент. Сразу же заказываем по выгодным ценам - потом можем отменить.  #экспресс";1;0;0;48;;КУПОНЫЧ ® │ промокоды и скидки;10378https://vk.com/wall-72876913_14214;https://vk.com/club72876913?w=wall-72876913_14214;https://vk.com/club72876913;https://vk.com/club72876913;2024-05-31 13:00;Ходовые позиции Xiaomi с доставкой из Китая 🇨🇳  Электрическая зубная щетка Xiaomi Mijia Sonic Electric Toothbrush T500C 💰 Цена в Китае 205 ¥ (Юани)  Ультразвуковой скалер Xiaomi Dr. Bei YC2 Ultrasonic Tooth Cleaner 💰 Цена в Китае 229 ¥ (Юани)  📦 Минимальный заказ из Китая: 600 usd или 4000 юаней, стоимость товара без учета доставки и комиссии.  По вопросам заказа: 👨‍💻 Менеджер [id643855918|Александр] | 📞 7 (917) 590-67-52 🙍‍♂ Менеджер [id645768981|Виктор] | 📞 7 (985) 559-93-67 📭 info@posrednik-china.com 📜 Актуальные прайсы https://vk.cc/9sLJty  #товарыоптом #опткитай #китайопт #оптомизкитая #посредникизкитая #посредниккитай #оптом #бизнес2024 #бизнесскитаем;0;0;0;47;;Доставка из Китая  l 1688.com l Alibaba.com;19604https://vk.com/wall-211253700_1761;https://vk.com/club211253700?w=wall-211253700_1761;https://vk.com/club211253700;https://vk.com/club211253700;2024-05-31 19:17;Брендирование продукции Revyline – это особый вид магии!    🔹 Индивидуальный стиль и выделение на фоне конкурентов Брендированная продукция подчеркнет ваши уникальность и профессионализм. Пациенты обязательно оценят ваше внимание к деталям и заботу о качестве предоставляемых услуг.  🔹 Укрепление доверия, повышение лояльности Доказано, что продукция с логотипом вашей клиники вызывает у пациентов больше доверия. Они будут уверены, что вы предлагаете только лучшее для их здоровья.  🔹 Отличный маркетинговый инструмент Брендированная продукция – идеальный способ повысить узнаваемость клиники, создать для нее яркую рекламу. Пациенты будут пользоваться щетками, ирригаторами и нитями дома, рассказывать о продукции друзьям, коллегам и т.д., что увеличит количество рекомендаций.  🔹 Статус и имидж Ваши пациенты оценят высокий уровень сервиса и качество продукции. Это – важный шаг к формированию положительного имиджа и репутации вашей клиники, к восприятию вас как эксперта.  🔹 Дополнительный доход Брендированная продукция может стать стабильным видом дохода для докторов и клиник.  Нанести ваш логотип мы можем на: 💜 Зубные щетки взрослые и детские  💜 Монопучковые щетки  💜 Зубные нити 3-х видов (PTFE, нейлон, брелок)  💜 Контейнеры для зубных конструкций   💜 Revyline Прозрачная косметичка    Минимальный тираж на эти позиции - 100 шт. 💜 Ирригатор RL660 PRO - минимальный тираж 20 шт. 💜 Электрические зубные щетки Revyline RL 030 - минимальный тираж 20 шт.  ⠀ ⠀ 📲 Узнать подробности и заказать брендированную продукцию можно в WatsApp: +7 (966) 099 47 62 Юлия и Ольга;2;0;0;40;;Revyline;3304https://vk.com/wall-208528848_5223;https://vk.com/club208528848?w=wall-208528848_5223;https://vk.com/club208528848;https://vk.com/club208528848;2024-05-31 18:28;"🔴Эл. Зубная щётка Philips Sonicare HX3673/13  📌Hoвaя уцeненная тexника!  🔥Ценa с уценкой в Теxдискoнт: 2800 pуб.  ⚠️ Витринный образец. Нарушена упаковка. ⚙️Гарaнтия 4 мecяца.  📍 Магазин: ""Техдисконт"", пр-т Дзержинского, 9/2 (дом с куполом). 🕥 10.00 - 19.00, без перерыва на обед и выходных. 📞Тел.: 8-922-888-01-85  Электрическая зубная щетка с дорожным футляром Philips HX3673/13 работает по звуковой технологии. Она делает до 31 000 выметающих движений в минуту. Благодаря этому образуется поток микропузырьков из смеси воды и пасты, эффективно удаляющий налет.  Устройство работает в режиме ежедневной чистки. Оно оснащено сенсором давления, который при необходимости автоматически снижает уровень вибрации, чтобы защитить десны. Звуковой таймер напоминает о том, что пора сменить область чистки.  У модели — водоустойчивый корпус. В него встроен литий-ионный аккумулятор, в котором достаточно энергии примерно на 14 дней. Батарея заряжается через порт USB. Кабель, который для этого требуется, входит в комплект.";0;0;0;33;;Texdiskont;1946https://vk.com/wall-138996418_105170;https://vk.com/club138996418?w=wall-138996418_105170;https://vk.com/club138996418;https://vk.com/club138996418;2024-05-31 14:51;🔥СРОЧНАЯ СКИДКА 🔥 ⚪️PHILIPS⚪️ Электрическая зубная щетка 💰2️⃣6️⃣6️⃣0️⃣₽ + вес 2.2₽/1гр   🇺🇸 Amazon.com  ✍Заказы сюда https://vk.com/album-138996418_281412475;1;0;0;33;;Brand Avenue. Совместные покупки из Америки;5432https://vk.com/wall-138996418_105171;https://vk.com/club138996418?w=wall-138996418_105171;https://vk.com/club138996418;https://vk.com/club138996418;2024-05-31 14:59;🔥СРОЧНАЯ СКИДКА 🔥 ⚪️VEKKIA⚪️ Электрическая детская зубная щетка с 3 сменными насадками  💰2️⃣1️⃣2️⃣8️⃣₽ + вес 2.2₽/1гр   🇺🇸 Amazon.com  ✍Заказы сюда https://vk.com/album-138996418_281412475;1;0;0;31;;Brand Avenue. Совместные покупки из Америки;5432https://vk.com/wall-138996418_105172;https://vk.com/club138996418?w=wall-138996418_105172;https://vk.com/club138996418;https://vk.com/club138996418;2024-05-31 15:02;🔥СРОЧНАЯ СКИДКА 🔥 ⚪️ORAL-B⚪️ Электрическая детская зубная щетка  💰7️⃣9️⃣8️⃣₽ + вес 2.2₽/1гр   🇺🇸 Amazon.com  ✍Заказы сюда https://vk.com/album-138996418_281412475;1;0;0;30;;Brand Avenue. Совместные покупки из Америки;5432https://vk.com/wall-34623148_32226;https://vk.com/club34623148?w=wall-34623148_32226;https://vk.com/club34623148;https://vk.com/club34623148;2024-05-31 20:15;"😉Польза и преимущества зубных электрических щеток    Современные электрические зубные щетки значительно превосходят обычные зубные щетки по качеству очистки зубов, а также уходу и профилактике заболеваний полости рта.    Преимуществом электрических зубных щеток по сравнению с обычными является👇👇👇    🔵 более качественная, превосходящая в несколько раз, очистка зубной эмали,  🔵 удаляют пигментацию от вина, табака и кофе,  🔵 частично удаляют зубные отложения (небольшие камни),  🔵 лечат кровоточивость десен, гингивит, сокращают околозубные карманы,  🔵 укрепляют десны, за счет улучшения кровоснабжения,  🔵 многофункциональны — позволяют делать надлежащим уход не только за зубами, но и за всей полостью рта, включая десны и язык,  🔵 возможность регулировать силу нажима щетки на зубную эмаль,  🔵 возможность контролировать время чистки зубов,  🔵 возможность использования зубной пасты с низким коэффициентом абразивности.    ➡В НАЛИЧИИ ДЕТСКИЕ И ВЗРОСЛЫЕ ЗУБНЫЕ ЩЕТКИ 🌈🌈🌈    ✅ Посетите наш магазин по адресу: Октябрьский проспект, д.48  ✅ Вы можете заказать товар с доставкой на дом следующими способами:  ☎ Позвоните по тел: 29-61-02  ✉ Напишите в личные сообщения консультанту [id137490360|Андрей Волков]  ✉ Воспользуйтесь кнопкой ""Написать сообщение"" в группе.";0;0;0;29;;МЕДТЕХНИКА+, Сыктывкар, Коми;6610https://vk.com/wall-100865779_16055;https://vk.com/club100865779?w=wall-100865779_16055;https://vk.com/club100865779;https://vk.com/club100865779;2024-05-31 17:00;⚠ Электрическая зубная щетка Xiaomi Mijia Electric Toothbrush T501 MES607 ⚠    🌈 Черный, белый    🌿 Система точного управления A, 30 индивидуальных програми, Технология колебательных деижений, Бесщеточный двигатель с магнитной левитацией, Отбеливающая насадна, 150 дней автономной работы, Влагозащита IPX8, Два цвета на выбор.    ✅ Купить оптом по цене 3050 рублей, товар на складе в Москве! Для оформления заказа свяжитесь с нашими менеджерами👇   🔍Есть вопросы? Задавайте!  +7 (916) 758 03 53 | [id517073014|Владимир Перов]  +7 (917) 542 86 65 | [id603961784|Андрей Ракитин]    🖥 Наш сайт - https://opt-instock.ru  📱 Мы в Телеграм - https://t.me/optinstock  📩 sales@opt-instock.ru    #товарыоптом #оптмосква #вналичииоптом #оптмосква #москваопт #вмосквеоптом #xiaomiвмоскве #оптомxiaomi #xiaomiоптом #вналичиимосква;0;0;0;16;;Xiaomi Haylou Тренды #Вналичии оптом в Москве;8734https://vk.com/wall-75552736_74229;https://vk.com/club75552736?w=wall-75552736_74229;https://vk.com/club75552736;https://vk.com/club75552736;2024-05-31 17:30;❗ Электрическая зубная щетка realme RTX2103 Blue  👉 Перейти к акции https://kups.club/goto/3bl9mm/vk  ✔ Цена 555 р.             МодельRTX2103Гарантия 1 год 20000 движений в минуту Антибактериальные щетинки  Dupont ™ 99,99% USB Type-C Количество насадок1 шт Время непрерывной работы 260 мин  #купоны #скидки #акции #халява #распродажа #;0;0;0;13;;Клуб любителей скидок;2226