https://vk.com/wall582968209_58135;https://vk.com/id582968209?w=wall582968209_58135;https://vk.com/id582968209;https://vk.com/id582968209;2024-06-05 10:03;Цена штучно: 199руб Цена оптом: 180руб (упак. 10шт=1800руб) Игрушка, пластик без выбора цвета Развивающая игрушка телефон Потрясающая игрушка для каждого ребенка. Очень милый и симпатичный дизайн, световые и звуковые эффекты, яркие цвета. Проигрывает мелодии, колыбельные, песенки  Ушки с рожками мягкие, можно использовать в качестве прорезывателей. Озвучка русская  Размер 14/8 см;2;2;1;133;;Сухроб Сайидов;13311
https://vk.com/wall-224733396_65;https://vk.com/club224733396?w=wall-224733396_65;https://vk.com/club224733396;https://vk.com/club224733396;2024-06-05 00:55;ПОСТ-ЗНАКОМСТВО👋   ✴Всем привет! Меня зовут Светлана, я мама четырёх замечательных деток и мне захотелось найти себе занятие в декрете!   ✴Я решила, что хочу и буду помогать деткам во время сложного периода - прорезывании зубов🦷👶🏻. А опыта у меня в этом деле предостаточно!)  ✴Мне пришло в голову создать свой личный бренд HAPPY TOSHKA❤   ✴Я училась у опытных мастеров, создала свой логотип, визитки, закупили фурнитуру, подарочную упаковку. Я очень горю этим делом! И мне приятно что именные держатели и грызунки это не только красивый аксессуар для малыша, но и очень полезный!   ✴В общем я буду очень рада Вам, вашим заказам, комментариям и пожеланиям!   С любовью и заботой о ваших малышах, магазин детских аксессуаров HAPPY TOSHKA 🌹;15;1;0;117;;ГРЫЗУНКИ КСТОВО | ИМЕННЫЕ ДЕРЖАТЕЛИ;21
https://vk.com/wall-159173765_6728;https://vk.com/club159173765?w=wall-159173765_6728;https://vk.com/club159173765;https://vk.com/club159173765;2024-06-05 14:15;"👍👍👍Сказка Ниблер силикон . Ниблер для прикорма ""Сказка"" создан для безопасного питания малыша и обучения самостоятельному разжевыванию пищи. Ниблер необходим для постепенного введения в рацион ребенка твердого прикорма. Ниблер оснащен гипоаллергенной и нетоксичной силиконовой насадкой , удобной ручкой и крышкой. Силиконовая насадка многоразовая. Соска для прикорма идеально подходит для кормления фруктами, овощами, ягодами, мясом и другой едой, соответствующей возрасту ребенка. Легко моется. Удобная ручка позволяет малышу надёжно удерживать ниблер. Во время прорезывания зубов нимблер послужит как грызунок и прорезыватель для зубов и поможет снять зуд.🍎🍏🍎";3;0;1;103;;"Детский магазин ""Семка""";2571
https://vk.com/wall582968209_58110;https://vk.com/id582968209?w=wall582968209_58110;https://vk.com/id582968209;https://vk.com/id582968209;2024-06-05 05:46;Цена штучно: 200руб Цена оптом: 150руб (упак. 12шт=1800руб) Игрушка, пластик без выбора цвета Проигрывает мелодии, колыбельные, песенки  Ушки с рожками мягкие, можно использовать в качестве прорезывателей. Озвучка русская  Размер 14/8 см;0;0;1;100;;Сухроб Сайидов;13311
https://vk.com/wall263821_9827;https://vk.com/id263821?w=wall263821_9827;https://vk.com/id263821;https://vk.com/id263821;2024-06-05 14:26;Продолжаю тему ромашек! 🌼    Вы знаете, что меня поразило? Какое же широкое использование этого эфирного масла в уходе за детьми! Я бы даже назвала его самым детским маслом. Но не забываем и про взрослых – забота о себе важна для всех.    Сегодня я поделюсь рецептами использования эфирного масла римской ромашки.    Как применять масло для детей?    🐬 ВАННЫ  Хотите успокоить вашего малыша и обеспечить ему спокойный сон? Попробуйте этот рецепт:  - Растворите 1 каплю римской ромашки в 30 мл сливок.  - Добавьте эту смесь в ванночку.  - Такая ванна успокоит малыша и станет отличной профилактикой сыпи от подгузников.    🐼 ПРОРЕЗЫВАНИЕ ЗУБОВ  Прорезывание зубов – это трудный период как для ребенка, так и для родителей. Масло римской ромашки поможет облегчить этот процесс:  - Смешайте 1 каплю римской ромашки с 10 мл базового масла.  - Мягко массируйте щеку с той стороны лица, где у ребенка режется зуб.    🐥 КОЛИКИ  Колики у малышей – это всегда причина для беспокойства. Попробуйте нежный массаж с маслом римской ромашки:  - Смешайте 1 каплю римской ромашки с 10 мл базового масла.  - Нанесите масло на руку и поглаживайте животик мягкими круговыми движениями по часовой стрелке в течение примерно пяти минут.  - Ребенок обязательно почувствует облегчение. 😊    Не забываем и о взрослых!  Для нас римская ромашка – универсальное успокаивающее средство. Она помогает при:  - Высоком давлении.  - ПМС и болях при месячных.  - Аллергии, высыпаниях и крапивнице.    Кроме того, римская ромашка идеально ухаживает за кожей. Сухая, раздраженная или увядающая кожа? Добавьте каплю ромашки в свой крем, и ваша кожа скажет вам «спасибо». 🌿    Поторопитесь, чтобы заказать это удивительное масло и ощутить всю силу природы у себя дома со скидкой 10%. Наслаждайтесь волшебными свойствами ромашки и дарите здоровье своим близким! 🌸;5;0;0;97;;Светлана Ремнева;2523
https://vk.com/wall-118533171_13180;https://vk.com/club118533171?w=wall-118533171_13180;https://vk.com/club118533171;https://vk.com/club118533171;2024-06-05 16:50;"🔥🔥🔥 ПОСТУПЛЕНИЕ 🔥🔥🔥       📌📌📌ЦЕНА  100 рублей. Прорезыватель ""Бантик"", 13*2*15 см";2;0;0;95;;ДЕТСКИЕ ТОВАРЫ ОПТ И РОЗНИЦА;65316
https://vk.com/wall45798120_2860;https://vk.com/id45798120?w=wall45798120_2860;https://vk.com/id45798120;https://vk.com/id45798120;2024-06-05 10:00;⭐️Профилактика нарушений прикуса с первого года жизни ⭐️  Жевание- это основа гармоничного развития челюстей, правильного прикуса и красивого лица🙌🏻  Навык жевания необходимо развивать  и помочь может в этом   НИБЛЕР - аксессуар для прикорма малышей первого года жизни 👶  Состоит из силиконовой насадки с отверстиями и ручки.    Внутрь  можно класть кусочки фруктов, овощей, хлеб и давать ребенку без опасения🍎  Для детей на искусственном вскармливании прикорм можно начинать с 4 мес.   На грудном вскармливании с 6 мес.  Данный аксессуар тренирует жевательную функцию у малыша с самого раннего возраста, что способствует росту челюстей и снижает риск нарушений прикуса, а в период прорезывания зубов облегчает зуд☺️  Более подробная статья   👇👇👇👇👇👇👇👇👇👇👇👇👇  https://www.akusherstvo.ru/guide/chto-takoe-nibler-i-kak-im-polzovatsya/  Лучшее лечение -это своевременная профилактика ❗️  #ортодонтчелябинск #исправлениеприкусачелябинск #брекетычелябинск #элайнерыдляисправленияприкуса  #элайнерычелябинск  #НаширбановаКристинаАндреевна  #ортобьютиважно #лечениедетейЧелябинск #детскийортодонтЧелябинск;10;1;0;84;;Кристина Наширбанова;474
https://vk.com/wall826459255_134;https://vk.com/id826459255?w=wall826459255_134;https://vk.com/id826459255;https://vk.com/id826459255;2024-06-05 14:22;Набор 🐰 Зайка с морковкой ❤️❤️❤️  Цена 1300₽ 🐰вязаная погремушка(+в морковке бусины) 🐰грызунок с прорезывателем (можжевел. и силикон) Бесплатная упаковка (коробочка с лентой, пакет) 🎁 доставка по г.Тольятти бесплатно❤️❤️❤️;10;0;0;73;;Simon Baby;3227
https://vk.com/wall-172375384_1063;https://vk.com/club172375384?w=wall-172375384_1063;https://vk.com/club172375384;https://vk.com/club172375384;2024-06-05 15:15;Новое поступление 0-6 мес и 6-12 мес.  Сделаны из латекса — природного и очень мягкого материала, безопасны, не вызывают аллергических реакций, успокаивают малыша и ослабляют неприятные ощущения при прорезывании зубов, а дырочки в нагубнике отводят слюни и обеспечивают вентиляцию.  Пустышки, выполненные в форме “вишня”, максимально приближены к женской анатомии, что позволяет малышу быстро их освоить  нагубники дополнены вентиляционными отверстиями  в комплектации удобный герметичный футляр  материал не содержит BPA (бисфенол А)  спокойные расцветки не будут перегружать нежную психику малыша.;0;0;0;69;;Baby&Mama г.Железногорск;819
https://vk.com/wall-118533171_13174;https://vk.com/club118533171?w=wall-118533171_13174;https://vk.com/club118533171;https://vk.com/club118533171;2024-06-05 16:12;🔥🔥🔥 ПОСТУПЛЕНИЕ 🔥🔥🔥        📌📌📌ЦЕНА 300 рублей. Погремушки с прорезывателями (7 штук в упаковке), в пакете ;1;0;0;63;;ДЕТСКИЕ ТОВАРЫ ОПТ И РОЗНИЦА;65316
https://vk.com/wall-118533171_13171;https://vk.com/club118533171?w=wall-118533171_13171;https://vk.com/club118533171;https://vk.com/club118533171;2024-06-05 16:04;🔥🔥🔥 ПОСТУПЛЕНИЕ 🔥🔥🔥        📌📌📌ЦЕНА  250 рублей. Погремушка с элементами прорезывателяL;1;1;0;58;;ДЕТСКИЕ ТОВАРЫ ОПТ И РОЗНИЦА;65316
https://vk.com/wall740613545_2844;https://vk.com/id740613545?w=wall740613545_2844;https://vk.com/id740613545;https://vk.com/id740613545;2024-06-05 15:30;В переходный возраст, в период сильнейших физиологических и психологических изменений, организм особенно нуждается в витаминах и минералах. Большая часть нутриентов поступает с пищей. Но далеко не каждый подросток соблюдает сбалансированный рацион питания. Поэтому им довольно часто требуется восполнять нехватку питательных веществ.  Сбалансированная витаминно-минеральная пищевая добавка показана для укрепления иммунитета, поддержания нервной системы и мозговой активности. Также прием средства снижает гиперактивность, нервозность, импульсивность, помогает справляться с информационными перегрузками. Организм особенно нуждается в нем в период полового созревания, когда работает буквально на износ, ведь в нем протекают серьезные изменения: пропорций тела, костно-мышечной системы, роста, веса, гормонального фона.  Сбалансированный состав витаминно-минерального комплекса для подростков: -поддерживает организм подростка в период активного роста и развития, -способствует полноценному росту и развитию скелета, -препятсвует искривлению опорно-двигательного аппарата, -повышает минерализацию и плотность костной ткани, -обеспечивает накопление костной массы, -снижает вероятность бытовых и спортивных травм, -ускоряет восстановление после травм и переломов, -укрепляет зубную эмаль, препятствует развитию кариеса, -способствует своевременному прорезыванию постоянных коренных зубов, -укрепляет ткань десен и препятствует их кровоточивости, -повышает плотность и укрепляет стенки кровеносных сосудов, -необходим для полноценного роста сосудов и сердца, -поддерживает физиологичный мышечный тонус, -устраняет непроизвольные сокращения мышц и судороги, -стимулирует кровообращение в головном мозге, -повышает мозговую активность при умственных нагрузках, -облечает запоминание информации, повышает концентрацию внимания, -укрепляет иммунитет, повышает защитные силы на всех уровнях, -служит профилактикой сезонных простудных заболеваний, -ускоряет выздоровление после перенесенных заболеваний, -нормализует процессы пищеварения и отток желчи, -обеспечивет полноценное развитие нервной системы, -оказывает успокаивающее действие, нормализует сон, -помогает справиться с раздражительностью и вспыльчивостью, -снимает психоэмоциональное напряжение и перегрузки, -поддерживает и сохраняет остроту зрения, уменьшает сухость слизистой, -улучшает состояние и питание сетчатки глаз, -нейтрализует негативное влияение излучений от гаджетов, -способствует усвоению железа из пищевых продуктов, -наполняет энергией и повышает выносливость, -облегчает процесс гормональной перестройки орагнизма, -нормальзует работы сальных желез, уменьшает жирность кожи, -препятствует появлению растяжек на коже при интенсивном росте, -поддерживает здоровье волос и ногтей.;3;0;0;51;;Екатерина Семеновна;2959
https://vk.com/wall-118533171_13173;https://vk.com/club118533171?w=wall-118533171_13173;https://vk.com/club118533171;https://vk.com/club118533171;2024-06-05 16:09;🔥🔥🔥 ПОСТУПЛЕНИЕ 🔥🔥🔥           📌📌📌ЦЕНА  250 рублей. Погремушки с прорезывателями (4 штуки в упаковке), в пакете;1;0;0;49;;ДЕТСКИЕ ТОВАРЫ ОПТ И РОЗНИЦА;65316
https://vk.com/wall679401239_258;https://vk.com/id679401239?w=wall679401239_258;https://vk.com/id679401239;https://vk.com/id679401239;2024-06-05 12:55;Грызуночки и держатели из безопасного 100% пищевого силикона!👌 ✨Все бусины можно грызть, но невозможно разгрызть, они мягко массируют десна малыша, облегчая процесс прорезывания зубов.👦 ✨Разнообразие форм, текстур и цветов 🌈способствует развитию мелкой моторики и цветового восприятия малыша. ✨ Такой интересный гаджет однозначно увлечет малыша👦🤗♥ и подарит маме минутки тишины.😉 ✨ Грызунок можно мыть, кипятить, морозить. ✨Грызунок - прорезываетель можно с лёгкостью заменить на соску !👶🎁🐕❤🌈;1;0;0;49;;Именные-Силиконовые-Грызунки Красноуфимск;2028
https://vk.com/wall-181603338_1197;https://vk.com/club181603338?w=wall-181603338_1197;https://vk.com/club181603338;https://vk.com/club181603338;2024-06-05 15:10;☝️🤓Грызунки из пищевого силикона по-праву считаются самыми популярными среди родителей ❤️ во-первых, из силикона можно производить прорезыватели самых разнообразных форм, структур и цветов ❤️❤️во-вторых это упругий и износостойкий материал, который достаточно сложно деформировать или откусить. 🥰В ТМ Жирафики самые качественные, удобные, яркие грызунки-прорезователи💞😉;3;0;0;42;;"Детский магазин  ""Совенок""";1010
https://vk.com/wall-118533171_13179;https://vk.com/club118533171?w=wall-118533171_13179;https://vk.com/club118533171;https://vk.com/club118533171;2024-06-05 16:49;"🔥🔥🔥 ПОСТУПЛЕНИЕ 🔥🔥🔥        📌📌📌ЦЕНА 100 рублей. Прорезыватель ""Бантик"", 13*2*15 см";1;0;0;40;;ДЕТСКИЕ ТОВАРЫ ОПТ И РОЗНИЦА;65316
https://vk.com/wall-216279721_103;https://vk.com/club216279721?w=wall-216279721_103;https://vk.com/club216279721;https://vk.com/club216279721;2024-06-05 10:15;Провал конечно....   Но так бывает 🤷‍♀️🤷‍♀️  Мы не смогли донести ценность нашего изделия, другие задачи были на тот момент, когда запускали это новое изделие , и упустили этот момент😔😔😔, а алгоритмы маркетплейсов таковы, что если мало продаж, то эта карточка товара тянет вниз весь наш ассортимент 😭  ПОЭТОМУ!!! У нас распродажа наборов для новорожденных!   Будем ли мы снова отшивать их и заводить новую карточку с этим товаром, мы пока не знаем 🤔  Наборы классные, состоят из шуршащего велюрового, с разноцветной репсовой лентой платочка и грызунок деревянный с шуршащими ушками!   Совсем малышам 👶 они очень нравятся , шуршалка велюровая приятная на ощупь и очень увлекает, успокаивает , грызунок деревянный с шуршащими ушками мега полезный, ушки можно снимать, стирать) Цена оочень привлекательная сейчас)   Ссылка 👇👇👇  https://wildberries.ru/catalog/176260127/detail.aspx;2;0;0;33;;Развивающие книжки и кубики MeriDe;91
