https://vk.com/wall-39756606_217685;https://vk.com/club39756606?w=wall-39756606_217685;https://vk.com/club39756606;https://vk.com/club39756606;2024-06-03 01:06;"Выглядеть в 50 лет на 30 возможно!  Косметические операции по возвращению утраченной молодости - удовольствие не из дешевых. Но оставаться ухоженной и привлекательной в этом возрасте под силу каждой женщине.  Есть женщины, которые разменяв полтинник, продолжает притягивать к себе восхищенные взгляды мужчин. В чем секрет? И в полноценном сне, и в ненапряженной работе, и в правильном питании, и в еженедельных походах в русскую баню, и др. При всем при том в арсенале этой женщины всегда присутствует крем, который она готовит сама.  Вот его рецепт.  Понадобится основа. Ею могут быть самые простые дешевые кремы, как «Вечер», «Янтарь», «Люкс», детский. Но, как показала практика изготовления, с «Янтарем» крем получается более нежным.  1. Один тюбик основы выдавите в стеклянную посуду.  2. Добавьте: 1 ч. ложку оливкового масла, 1 ч. ложку спиртового раствора алоэ, 5-6 капель витамина А, 56 капель витамина Е, 1 ч. ложку коньяка или ""Бальзама Биттнера"", 5-6 капель сока лимона, 2-3 капли любимого эфирного масла розы.  3. Все хорошо размешайте деревянной палочкой.  4. Немного крема отложите в маленькую баночку - используйте в первую очередь. Большую часть крема храните в холодильнике.  Витамины и ароматическое масло купите в аптеке. Пользуйтесь кремом два раза в день и радуйтесь жизни! ______________ Не забудьте подписаться на наш журнал -  [club39756606|Советы и Идеи]";5;5;1;3128;;Советы и Идеи;780078
https://vk.com/wall-62773605_605194;https://vk.com/club62773605?w=wall-62773605_605194;https://vk.com/club62773605;https://vk.com/club62773605;2024-06-03 12:26;Добрый вечер! Весенняя 29, возле 4 подъезда жительница первого подъезда развела питомник для бродячих котов и кошек . вытоптан и загажен газон. прикормила котов и кошек со всей округи. примите меры. на замечания не реагирует. что лучше смотрится на газоне цветы или свалка?;2;1;27;3127;;Подслушано в Чехове;41204
https://vk.com/wall-127428039_133251;https://vk.com/club127428039?w=wall-127428039_133251;https://vk.com/club127428039;https://vk.com/club127428039;2024-06-03 15:50;Травы против отечности 🌿    Семена петрушки  Петрушка применяется при лечении отечности и зарекомендовала себя как эффективное и мягкое средство. Употребление настоев и отваров позволит вывести излишки жидкости, вредные вещества из организма человека.  Добавляя зелень петрушки, корень или семена, можно профилактически предупредить возникновение отеков. Растение содержит большое количество флавоноидов. Это антиоксиданты, которые борются с воздействием на организм свободных радикалов: препятствуют накоплению излишков жидкости и приводят в тонус ткани, клетки.    Сельдерей  Сок растения содержит большое количество минералов, практически все витамины, необходимые для поддержания организма человека в здоровом состоянии. Народная медицина использует сельдерей для лечения отеков. Натрий, калий и магний, которые поддерживают водно-солевой баланс, содержатся в соке растения. При употреблении сельдерея происходит стимуляция работы печени и почек, ускоряется вывод токсических веществ. Из организма выделяется излишняя вода и происходит восстановление нормального соотношения жидкости в межтканевом пространстве и тканях. Ученые, проводившие исследования растения уверены в том, что по действию его можно приравнять к женьшеню.    Сельдерей нельзя принимать, как беременным, так и кормящим мамам. От него зависит специфический привкус грудного молока и уменьшается его выработка.    Анис  Используется, когда нужно убрать отеки при патологиях мочевыводящих путей. Для приготовления настоя необходимо брать только сырые семена. Залить двумя литрами кипятка чайную ложку сырья. Настаивать 3 дня. Перед каждым приемом пищи необходимо употреблять по столовой ложке. Семена помогут снять отеки и нормализуют метаболизм. Анис запрещается использовать беременным женщинам.    Лен  Наиболее быстродействующее средство. Больной ощущает позывы к мочеиспусканию после первого приема льна. Всего за 1-2 дня жидкость, которая послужила причиной отеков, может быть выведена из организма.  Отвар готовится из 3 столовых ложек семян льна, которые заливаются литром крутого кипятка. Смесь должна настояться. В том случае, если получившийся отвар слишком горький, добавьте к нему немного меда или несколько капель лимонного сока.  Лечение семенами нужно проводить, когда есть возможность находиться дома, поскольку лен – это очень сильный природный диуретик.    Листья брусники  Листья брусники насыщены минералами и витаминами: кальций, калий, натрий, фосфор, С, В. Употребляется, как профилактическое средство, иммуностимулирующее и для лечения авитаминоза. Флавоноиды, входящие в состав растения, оказывают положительное влияние на сосуды, приводят их в тонус, нормализуют давление. Белок, который является легкоусвояемым поможет при реабилитации после отравлений, после тяжелых болезней и строгой диеты. Все вещества – антиоксиданты. Они защищают клетки человеческого организма от воздействия свободных радикалов, нарушающих процесс нормального воспроизводства тканей и ускоряющих старение.    Пастушья сумка  Растение обладает вяжущими, противовоспалительными свойствами. Использование пастушьей сумки наружно, в качестве примочки, снимает отек, уменьшает воспалительные процессы, может остановить кровотечение небольших ран на слизистых оболочках и на поверхности кожи. Использование лекарственной травы помогает при выведении камней, при заболеваниях выделительной системы, применяется при воспалительных, тяжело протекающих процессах.    Пастушья сумка обладает сосудорасширяющим, мочегонным, а также противолихорадочным действием. Растение нормализует сон, имеет действие, как успокаивающее и противодействующее депрессии и стрессу. Народная медицина использует пастушью сумку для очищения печени, почек, желчного пузыря, а для мышцы сердца — как дополнительный витамин.    Природные диуретики при отеках лица  Следующие растения:  -семена льна,  -пол-пала,  -кукурузные рыльца,  -листья свеклы.    Травы при отеках ног  Хвощ полевой  Употребление хвоща помогает устранить проблему белка в моче. Растение вызывает стимуляцию мочевыделения и дезинфицирует мочевыводящие пути. Отвары травы помогают снять отеки сердечного, почечного происхождения. Наряду с мочегонным эффектом выявлено и болеутоляющее действие. Издавна полевой хвощ использовали при лечении различных заболеваний опорно-двигательного аппарата, внутренних кровотечениях, наличии в почках камней.    Употребление травяного настоя не рекомендуется при нефрозах, нефритах, беременным женщинам, детям. Побочные реакции бывают крайне редко. Длительное, неправильное применение лекарственной травы может спровоцировать расстройство пищеварения, аллергические реакции.    Ромашка  Ромашка аптечная обладает не только мочегонным действием, но и болеутоляющим, противовоспалительным, желчегонным, ветрогонным, вяжущим, седативным, спазмолитическим и противоаллергическим. В состав растения входит хамазулен. Именно это вещество успокаивает нервную систему, стимулирует работу головного мозга, активизируя кровообращение мозговых сосудов, благотворно влияет на органы пищеварения.    Ромашка имеет успокаивающее, положительное влияние на все типы кожи, поэтому снимает различные воспаления и зуд, помогает устранить отечность, красноту. При беременности употребление запрещено, а при кормлении грудью необходимо подходить к вопросу использования с осторожностью. Перед применением настоев и отваров ромашки необходимо посоветоваться с врачом тем людям, которые принимают жизненно важные лекарства и тем, у кого есть хронические заболевания. При индивидуальной непереносимости также не использовать растение для лечения.    Толокнянка  Растение обладает мощным диуретическим эффектом. Для приготовления отвара залить чайную ложку листьев 100 мл кипятка и томить на медленном огне до получаса. Затем процедить, добавить в отвар еще 100 мл кипяченой воды. Применять за 40 минут до еды по 1 столовой ложке, 6 раз в день.    Крапива  Как мочегонное средство, используются высушенные и свежие стебли, листья и масло.    Массажное масло из крапивы: для его приготовления, измельчите свежие листья, смешивают с подсолнечным маслом в одинаковом соотношении. Затем полученную массу нагревают на водяной бане до момента закипания. В остывшем виде втирают в кожу ног.  Настой из смеси трав с крапивой: смешать равные части листьев крапивы, зверобоя и ромашки (по 1 ч.л.), затем залить крутым кипятком, дать настояться 1 час. Далее разделить настой на 5 частей, принимать перед едой в течение дня.    Мелисса  Трава является сильным природным диуретиком. Уменьшает болевые симптомы при патологиях выделительной системы, мочекаменной болезни. Снимает воспалительные процессы, наличие интоксикации, улучшает кислотность мочи. Для приготовления отвара столовую ложку сухих стеблей и листьев растения необходимо залить 200 мл крутого кипятка, прокипятить в течение 10 минут и процедить. Употреблять перед едой по 1 столовой ложке.    Внимание! Перед применением любого средства или метода лечения обязательно проконсультируйтесь с врачом, так как у большинства растений/масел/продуктов есть противопоказания для применения!;20;29;0;3049;;Сила трав;278583
https://vk.com/wall-118474860_5366715;https://vk.com/club118474860?w=wall-118474860_5366715;https://vk.com/club118474860;https://vk.com/club118474860;2024-06-03 12:30;Девочки,здравствуйте ! Вопрос к мамам: ситуация- ребёнку 1,2,говорит 5 слов и много слогов,просьбы выполняет ( принести книжку,погладить кошечку,поиграй в мячик и тд), понимает «нельзя»,активная ,любит гулять на детских площадках ,проявляет эмоции при виде детей (улыбается ,издаёт визги). Меня беспокоит ,что она не ходит ( только возле опоры и за ручку),мало слов(что каждый ребёнок индивидуален и у каждого свой темп развития я в курсе), не любит заниматься ,т.е. неусидчивая ,не любит книжки (просто их смотрит и пытается их разорвать),на имя откликается не всегда (такое ощущение ,что специально так делает). Кушает сама ложкой (неаккуратно и долго),пьёт из своей кружечки. Может кто-то подумает ,что я много хочу от своего ребёнка ,но я же вижу других детей и их развитие. Очень боюсь ,что может быть упущено время ,так как есть проблемы. Невролог ничего не говорит плохого,посоветовала массаж и плавание. Может посоветуйте куда сходить ,какие есть центры ,может книги/развивашки.  Специалистов,кто реально сможет оценить развитие ребёнка.;2;1;17;2784;;Женская Рязань;62834
https://vk.com/wall-155386267_1436265;https://vk.com/club155386267?w=wall-155386267_1436265;https://vk.com/club155386267;https://vk.com/club155386267;2024-06-03 09:50;Анонимно пожалуйста  Здравствуйте, мамочки подскажи пожалуйста ребенок первый.  Нам 10 месяцев в туалет по большому стали ходить через день это норма? Мы на гв, прикорм мало едим, только супчики и кашки , ну и фрукты… Тапками не кидать, идите мимо);2;0;8;2685;;Мамочки;130357
https://vk.com/wall-103919075_2095;https://vk.com/club103919075?w=wall-103919075_2095;https://vk.com/club103919075;https://vk.com/club103919075;2024-06-03 17:55;Почему яблоко не подходит для первого прикорма? 1. После вкусных яблок ребенок не захочет есть овощи. 2. В яблоках мало белков. 3. Яблоки могут вызвать аллергию и нарушения в работе ЖКТ.  Вводить в прикорм яблоки нужно после каш и овощей (в 6-7 месячном возрасте). Они богаты витамином С, витаминами группы В, магнием, фосфором, цинком.  Начинать ввод яблока в рацион лучше с пюре. Схема введения фруктового пюре на первом году жизни: 4-5 мес. – 5-50 гр 6 мес. – 60гр 7 мес. – 70гр 8 мес. – 80гр 9-12 мес. – 90-100гр.;5;3;0;2426;;ДЕТСКОЕ ПИТАНИЕ;1376
https://vk.com/wall-155386267_1436074;https://vk.com/club155386267?w=wall-155386267_1436074;https://vk.com/club155386267;https://vk.com/club155386267;2024-06-03 00:01;Анонимно Здравствуйте) подскажите как правильно заменять одно кормление смесью?  Начала прикорм с овощного пюре  Даю по 40г. минут за 20 до смеси. Уже неделю так.. с каждым днем увеличивать порцию и давать меньше смеси или как правильно?;0;0;3;2396;;Мамочки;130357
